{
  "$schema": "http://json-schema.org/schema#",
  "$schemaVersion": "1.3.0",
  "$id": "https://smart-data-models.github.io/dataModel.DigitalMarketing/Brand/schema.json",
  "title": "Smart Data Models - Brand",
  "description": "A brand operated by a legal organization. It represents a commercial identity (name, sector) decoupled from the legal entity (Organization) so that a single Organization can operate several Brands and one Brand can group several DigitalAssets (web, app, social profiles).",
  "modelTags": "DigitalMarketing",
  "type": "object",
  "properties": {
    "id": {
      "anyOf": [
        {
          "type": "string",
          "minLength": 1,
          "maxLength": 256,
          "pattern": "^[\\w\\-\\.\\{\\}\\$\\+\\*\\[\\]`|~^@!,:\\\\]+$"
        },
        {
          "type": "string",
          "format": "uri"
        }
      ],
      "description": "Unique identifier of the entity. Recommended pattern: urn:ngsi-ld:Brand:<short-name> or urn:ngsi-ld:Brand:<vatID>:<short-name> when a brand name is not globally unique."
    },
    "type": {
      "type": "string",
      "enum": [
        "Brand"
      ],
      "description": "Property. NGSI Entity type. It has to be Brand."
    },
    "name": {
      "type": "string",
      "description": "Property. Commercial name of the brand."
    },
    "alternateName": {
      "type": "string",
      "description": "Property. Alternative or short name of the brand."
    },
    "description": {
      "type": "string",
      "description": "Property. Description of the brand and its activity."
    },
    "businessSection": {
      "type": "array",
      "minItems": 1,
      "items": {
        "type": "string",
        "pattern": "^(?:[A-U]|[0-9]{2}(?:\\.[0-9]{1,2})?)$",
        "description": "NACE Rev. 2.1 code in canonical form: section letter (A-U), division (XX), group (XX.Y) or class (XX.YY). Letter and digits are NEVER concatenated."
      },
      "description": "Property. List of NACE Rev. 2.1 codes that classify the economic sector(s) of the brand. Example: ['62.01', '73.11'] for IT consulting + advertising agencies. Levels can be mixed in the same list when precision varies per sector."
    },
    "url": {
      "type": "string",
      "format": "uri",
      "description": "Property. Canonical URL of the brand (corporate site, landing, etc.)."
    },
    "refOrganization": {
      "anyOf": [
        {
          "type": "string",
          "minLength": 1,
          "maxLength": 256,
          "pattern": "^[\\w\\-\\.\\{\\}\\$\\+\\*\\[\\]`|~^@!,:\\\\]+$"
        },
        {
          "type": "string",
          "format": "uri"
        }
      ],
      "description": "Relationship. URN of the Organization that legally owns and operates this brand."
    }
  },
  "required": [
    "id",
    "type",
    "name",
    "businessSection",
    "refOrganization"
  ],
  "derivedFrom": "",
  "license": "https://github.com/smart-data-models/dataModel.DigitalMarketing/blob/master/LICENSE.md"
}