{
  "id": "urn:ngsi-ld:Brand:Acme",
  "type": "Brand",
  "name": "Acme",
  "alternateName": "AcmeOne",
  "description": "Digital marketing analytics platform operated by Acme Holdings S.L.",
  "businessSection": ["62.01", "73.11"],
  "url": "https://acme.example",
  "refOrganization": "urn:ngsi-ld:Organization:ES-B12345678"
}
